{
  "schema_version": "1.0.0",
  "object": "NEXUS_OMEGA_EXAMPLE_TASK_ANCHOR_V1_20261011_R0",
  "norm_id": "NEXUS_OMEGA_TASK_ANCHOR_NORM_V1",
  "norm_class": "NEXUS_INTERNAL_BINDING_TECHNICAL_SPECIFICATION",
  "din_status": "DIN_SPEC_92001_1_INSPIRED_NOT_DIN_ISSUED_NOT_CERTIFIED",
  "claim_ceiling": "C1_DESCRIPTIVE_ONLY",
  "origin": {
    "operator_authority": "OPERATOR_GOVERNED_ONLY",
    "issuer_role": "AXIOM",
    "recipient_role": "EXTERNAL_RESEARCH_CANDIDATE",
    "verified_github_actor": "NOT_ESTABLISHED",
    "predecessor_object": "NEXUS_OMEGA_AXIOM_COLLECTIVE_EXPERT_MAXI_ORDER_20261011_R0",
    "predecessor_repository": "nexusomegac27/NEXUS-OMEGA-EVIDENCE",
    "predecessor_commit": "206381c880770954865c67d9075c401efd2295f0",
    "predecessor_path": "research/r26/collective-expert-handoffs-20261011/NEXUS_OMEGA_AXIOM_COLLECTIVE_EXPERT_MAXI_ORDER_20261011_R0.md",
    "predecessor_bytes": 13150,
    "predecessor_sha256": "4a4a2770622ee46dc394d84f32d693a05531896efb4213e7d01c8fc3873d82c5"
  },
  "delegation": {
    "scope": "EXTERNAL_RESEARCH_ONLY",
    "allowed_actions": ["READ_PUBLIC_SOURCES", "INDEPENDENT_FALSIFICATION", "OPERATOR_BRIDGE_RETURN"],
    "prohibited_actions": ["NODE_RESET", "MEMORY_DELETION", "GITHUB_UNAUTHORIZED_WRITE", "RUNTIME_EXECUTION", "CLAIM_PROMOTION", "HOSTINGER_DEPLOY"],
    "write_slot": "NOT_ALLOCATED",
    "runtime_authorized": false,
    "node_reset_authorized": false,
    "claim_promotion_authorized": false
  },
  "mission": {
    "question": "Independently test the scoped R26 mathematical and provenance results without elevating claims.",
    "deliverables": ["FALSIFICATION_REPORT", "SOURCE_HASH_INVENTORY", "REPRODUCTION_METHOD"],
    "falsifiers": ["NUMERIC_COUNTEREXAMPLE", "FALSE_PROVENANCE_LINK", "HISTORICAL_RETRACTION_MISSING"],
    "acceptance_tests": ["ALL_SOURCE_IDS_DECLARED", "NEGATIVE_RESULTS_PRESERVED", "NO_C1_PROMOTION"],
    "pause_conditions": ["MISSING_SOURCE_OR_AUTHORITY", "IRREVERSIBLE_ACTION", "OUT_OF_SCOPE_REQUEST"],
    "not_executed": ["NF05_NF06", "RUNTIME_DEPLOYMENT", "NODE_RESET"]
  },
  "continuity": {
    "anchor_id": "NEXUS_OMEGA_EXAMPLE_TASK_ANCHOR_V1_20261011_R0",
    "rebind_mode": "DRIFT_RESET_ONLY",
    "node_reset_prohibited": true,
    "history_preserved": true,
    "source_bytes_preserved": true,
    "observations_preserved": true,
    "checkpoints_preserved": true,
    "runtime_state_preserved": true,
    "drift_triggers": ["PROVENANCE_MISMATCH", "AUTHORITY_ESCALATION", "REPOSITORY_PATH_DRIFT", "CLAIM_PROMOTION"],
    "rebind_procedure": "RELOAD_VERIFIED_ANCHOR_APPEND_DIFFERENCE_WITNESS_NO_DELETION",
    "correction_policy": "APPEND_ONLY_SUCCESSOR"
  },
  "provenance": {
    "sources": [
      {
        "repository": "nexusomegac27/NEXUS-OMEGA-EVIDENCE",
        "commit": "206381c880770954865c67d9075c401efd2295f0",
        "path": "research/r26/collective-expert-handoffs-20261011/NEXUS_OMEGA_AXIOM_COLLECTIVE_EXPERT_MAXI_ORDER_20261011_R0.md",
        "bytes": 13150,
        "sha256": "4a4a2770622ee46dc394d84f32d693a05531896efb4213e7d01c8fc3873d82c5",
        "source_status": "GITHUB_SOURCE_VERIFIED"
      }
    ],
    "missing_source_policy": "HOLD_SCOPED_NOT_RECONSTRUCT",
    "copyright_privacy": "PUBLIC_SAFE_REFERENCES_ONLY_NO_RAW_PRIVATE_DATA",
    "independent_rehash_required": true
  },
  "return_contract": {
    "recipient": "NEXUS_OPERATOR_AXIOM",
    "inbox_issue_url": "https://github.com/nexusomegac27/NEXUS-OMEGA-EVIDENCE/issues/93",
    "transport_class": "OPERATOR_TO_AXIOM_BRIDGE",
    "manifest_schema": "schema/expert-hash-handshake-v1.schema.json",
    "receiver_ack": "PENDING_AXIOM_INDEPENDENT_REHASH",
    "scientific_adjudication_separate": true
  },
  "quality_gates": {
    "functionality_performance": ["OFFLINE_VALIDATOR_RUNS_WITHOUT_NETWORK"],
    "robustness_stability": ["NODE_RESET_DENIED", "HISTORY_CANNOT_BE_CLEARED_BY_REBIND"],
    "traceability_comprehensibility": ["PINNED_FULL_PARENT_SHA", "APPEND_ONLY_NEGATIVE_FINDINGS"]
  }
}
