{
  "schema_version": "1.0.0",
  "object": "NEXUS_OMEGA_AXIOM_MISTRAL_P0_ORIGINAL_PYTHON_FALSIFICATION_CURSOR_REPAIR_TASK_ANCHOR_20261101_R0",
  "norm_id": "NEXUS_OMEGA_TASK_ANCHOR_NORM_V1",
  "norm_class": "NEXUS_INTERNAL_BINDING_TECHNICAL_SPECIFICATION",
  "din_status": "DIN_SPEC_92001_1_INSPIRED_NOT_DIN_ISSUED_NOT_CERTIFIED",
  "claim_ceiling": "C1_DESCRIPTIVE_ONLY",
  "origin": {
    "operator_authority": "OPERATOR_GOVERNED_ONLY",
    "issuer_role": "AXIOM",
    "recipient_role": "CURSOR",
    "verified_github_actor": "NOT_ESTABLISHED_EXTERNAL_AGENT",
    "predecessor_object": "NEXUS_OMEGA_AXIOM_INDEPENDENT_TRUSTED_WITNESS_P0_READBACK_AND_CI_REPAIR_20261101_R0",
    "predecessor_repository": "nexusomegac27/NEXUS-OMEGA-EVIDENCE",
    "predecessor_commit": "21318fa13b6924d233c50d521deab7b689f754cb",
    "predecessor_path": "research/communication/github-only-exchange-enforcement-20261029/AXIOM_INDEPENDENT_TRUSTED_WITNESS_P0_READBACK_AND_CI_REPAIR_20261101_R0.md",
    "predecessor_bytes": 7013,
    "predecessor_sha256": "7c8268e78f6415ad05a2743bdddfb029b613b5eabf6da9d10f68419006e46888"
  },
  "delegation": {
    "scope": "CURSOR_TARGETED_P0_REPAIR_ORIGINAL_PYTHON_FALSIFIED_FINDINGS_MISTRAL_RESEARCH_C1",
    "allowed_actions": [
      "VERIFY_SOURCE_PINNED_ORDER_AND_EXPERT_INTAKE_PROVENANCE",
      "EXECUTE_MINIMAL_P0_REPAIR_EXISTING_DOCUMENT_ROUTER_AND_EXCHANGE_CHAIN",
      "REPLACE_CALLER_ATTESTATIONS_WITH_VERIFIER_OWNED_ACTUAL_API_AND_BYTES_WITNESSES",
      "ADD_REAL_ORIGINAL_PYTHON_REPAIRED_NEGATIVE_ASSERTIONS",
      "FIX_SQLITE_REPLAY_TRANSACTIONS_AND_CRASH_RECONCILIATION",
      "VERIFY_OWNER_CUTOVER_AND_PRIVATE_RIGHTS_ONLY_FROM_TRUSTED_SOURCES",
      "RUN_LINUX_GITHUB_CI_AND_WINDOWS_PARITY",
      "COMMIT_GOVERNED_IMPLEMENTATION_SOURCE_AND_RETURNS_NO_MERGE",
      "PRESERVE_LIVE_READ_ONLY_AGENT_BORDER_AND_LIVING_FOUNDATION",
      "RETURN_FULL_SHA256_AND_ACTUAL_EXTERNAL_CAPABILITY_GAPS"
    ],
    "prohibited_actions": [
      "NEW_AGENT_COMMUNICATION_FRAMEWORK",
      "WEAKEN_R27E_VALIDATOR",
      "REWRITE_PREVIOUS_V1_C1_SOURCE_EVIDENCE",
      "PUBLIC_WRITE_API_ACTIVATION",
      "UNAUTHORIZED_HOSTINGER_WWW_WRITE",
      "UNAUTHORIZED_AGENT_ACCOUNT_APP_PAT_OR_CREDENTIAL_GRANT",
      "FAKE_GITHUB_ACTOR_OR_EXTERNAL_ACK",
      "CUTOVER_ACTIVE_WITHOUT_REAL_OWNER_CI_PRIVACY_ROLLBACK_PROOF",
      "RAW_PRIVATE_EXPERT_RETURN_TO_PUBLIC_GITHUB",
      "CLAIM_PROMOTION_ABOVE_C1",
      "NATIVE_APP_R3",
      "NODE_RESET"
    ],
    "write_slot": "NOT_ALLOCATED",
    "runtime_authorized": false,
    "node_reset_authorized": false,
    "claim_promotion_authorized": false
  },
  "mission": {
    "question": "Independently repair the twelve ACTUALLY REPRODUCED original-Python P0 defective behaviors from external MISTRAL's 12-round report while preserving unverified external recipient and cutover as HOLD until actually proven.",
    "deliverables": [
      "EXISTING_ROUTER_PATCH_AND_EXCHANGE_CHAIN_MINIMAL_DIFF",
      "F01_F15_X1_X8_CORRECT_POSTFIX_NEGATIVE_ASSERTIONS",
      "TRUSTED_GITHUB_ISSUE_COMMENT_AUTHOR_SLOT_AND_SOURCE_BYTES_VERIFIER",
      "DURABLE_IDEMPOTENT_SQLITE_WAL_AND_OUTBOX_RECOVERY",
      "GOVERNED_OWNER_CUTOVER_AND_PRIVATE_LANE_RIGHTS",
      "ACTUAL_GITHUB_CI_ORIGINAL_PYTHON_REGRESSIONS",
      "RECEIVER_EXTERNAL_E2E_IF_AUTHORIZED_ELSE_SCOPED_HOLD",
      "EXACT_SOURCE_MANIFEST_AND_TASK_ANCHOR",
      "PUBLIC_WEB_READ_ONLY_PRESERVED",
      "RETURN_GITHUB_COMMIT_RESULT_SHA_AND_CI_JOB_IDS"
    ],
    "falsifiers": [
      "UNTRUSTED_HASH_PROMOTED_TO_RECEIVED_BYTES_VERIFIED",
      "FOREIGN_REPO_COMMENT_PROMOTED_TO_PRINCIPAL",
      "UNREGISTERED_OR_OWNER_ACCOUNT_IMPERSONATES_DISTINCT_RECEIVER",
      "REAL_GITHUB_ISSUE_COMMENT_URL_STILL_REJECTED",
      "FORGED_OWNER_OR_PRIVATE_LANE_JSON_ACTIVATES",
      "DISPATCHED_WITHOUT_ACTUAL_PROVIDER_RECEIPT",
      "GENUINE_TRANSPORT_DELIVERY_IMPOSSIBLE_DUE_TO_STATUS_KEY_MISMATCH",
      "SQLITE_DUPLICATE_DOCUMENT_UNHANDLED_INTEGRITY_ERROR",
      "ANY_POSITIVE_ASSERTION_WITH_OR_TRUE_TAUTOLOGY",
      "R27E_THRESHOLD_WEAKENED",
      "PUBLIC_WRITE_API_ENABLED_OR_PRIVATE_DATA_PUBLISHED"
    ],
    "acceptance_tests": [
      "EXACT_ORIGINAL_PYTHON_BASELINE_12_OF_12_EXPECTED_DEFECT_REPRODUCED_RUN_41270081586_JOB_124740888286",
      "FIXED_ROUTER_TESTS_FAIL_CLOSED_ON_ALL_IDENTIFIED_P0_NEGATIVE_INPUTS",
      "RECEIVER_ID_AND_SOURCE_BYTES_VERIFIER_INDEPENDENT_FETCH_OR_NOT_ESTABLISHED",
      "DOCUMENT_RECEIPT_STATUS_NO_UNTRUSTED_SOURCE_PROMOTION",
      "REAL_GITHUB_COMMENT_URL_AND_RETURN_SLOT_PARSE_MATCH",
      "NO_ACTOR_PERMISSION_PROMOTION_FROM_MODEL_NAME_OR_AUTHOR_ASSOCIATION_ALONE",
      "ATOMIC_RECEIPT_AND_STATE_TRANSACTIONS_AND_REPLAY_RECOVERY",
      "SOURCE_CODE_SHA256_AND_GITHUB_CI_RESULTS_ON_ACTUAL_FINAL_TIP",
      "WWW_PUBLIC_READ_ONLY_3_OF_3_PRESERVE",
      "SCOPED_HOLD_IF_REAL_EXTERNAL_ACTOR_ABSENT"
    ],
    "pause_conditions": [
      "REPOSITORY_SOURCE_REF_OR_BYTES_MISMATCH_PRESERVE_SOURCE_GAP",
      "UNAUTHORIZED_EXTERNAL_ACTOR_OR_PRIVATE_LANE_NO_GRANT",
      "ACTUAL_WWW_DEPLOY_OR_PUBLIC_WRITE_NOT_IN_SCOPE",
      "CRITICAL_RELEASE_GATES_MISSING_KEEP_CUTOVER_STAGED"
    ],
    "not_executed": [
      "AXIOM_HAD_NO_AUTHORIZED_REAL_EXTERNAL_GITHUB_RECEIVER_ACCOUNT",
      "AXIOM_DID_NOT_RUN_MISTRAL_24_TYPESCRIPT_VECTORS",
      "POWER_LOSS_FAULT_INJECTION_NOT_YET_EXECUTED",
      "PUBLIC_POST_WRITE_API",
      "DOCUMENT_CUTOVER",
      "PR185_MERGE"
    ]
  },
  "continuity": {
    "anchor_id": "NEXUS_OMEGA_AXIOM_MISTRAL_P0_ORIGINAL_PYTHON_FALSIFICATION_CURSOR_REPAIR_TASK_ANCHOR_20261101_R0",
    "rebind_mode": "DRIFT_RESET_ONLY",
    "node_reset_prohibited": true,
    "history_preserved": true,
    "source_bytes_preserved": true,
    "observations_preserved": true,
    "checkpoints_preserved": true,
    "runtime_state_preserved": true,
    "drift_triggers": [
      "ORIGINAL_SOURCE_SHA_MISMATCH",
      "ORIGINAL_PYTHON_DEFECT_NOT_REPRODUCIBLE_ON_PIN",
      "CALLER_PROVIDED_HASH_TRUSTED_AS_INDEPENDENT",
      "ARBITRARY_STATE_SKIP",
      "OWNER_RIGHTS_SELF_ISSUED",
      "PUBLIC_WRITE_API_PROMOTION",
      "EXTERNAL_ACK_WITHOUT_REAL_ACTOR",
      "R27E_VALIDATOR_WEAKENED"
    ],
    "rebind_procedure": "RELOAD_VERIFIED_ANCHOR_APPEND_DIFFERENCE_WITNESS_NO_DELETION",
    "correction_policy": "APPEND_ONLY_SUCCESSOR"
  },
  "provenance": {
    "sources": [
      {
        "repository": "nexusomegac27/NEXUS-OMEGA-EVIDENCE",
        "commit": "e5f9dcba496dcd5772f88fa758c6183f10a80cdc",
        "path": "research/communication/p0-diagnostics-20261101/AXIOM_MISTRAL_P0_ADJUDICATION_AND_CURSOR_HARD_REPAIR_ORDER_20261101_R0.md",
        "bytes": 12818,
        "sha256": "3a94e1b4ed073682f2f792020209ebdc1cbcfa31d60e4fdd6b1beab51f7e2a30",
        "source_status": "GITHUB_SOURCE_VERIFIED"
      },
      {
        "repository": "nexusomegac27/NEXUS-OMEGA-EVIDENCE",
        "commit": "f7628b8411809f130c54e7beaa062ed809da82f2",
        "path": "research/communication/p0-diagnostics-20261101/test_mistral_original_python_vulnerabilities.py",
        "bytes": 9240,
        "sha256": "8f2fde9c437c515e0c4281eed986c797da6d77a92c0751dd12638eb40eb5d41c",
        "source_status": "GITHUB_SOURCE_VERIFIED"
      },
      {
        "repository": "nexusomegac27/NEXUS-OMEGA-EVIDENCE",
        "commit": "986b9af8f4bcfb341a188cbb6ed7d8da3d500e98",
        "path": "scripts/nexus_document_router.py",
        "bytes": 50522,
        "sha256": "31a30eaae3bad5f52225947206a3ee7f3c22ae337400dca01519be0a596351ec",
        "source_status": "GITHUB_SOURCE_VERIFIED"
      },
      {
        "repository": "nexusomegac27/NEXUS-OMEGA-EVIDENCE",
        "commit": "986b9af8f4bcfb341a188cbb6ed7d8da3d500e98",
        "path": "scripts/nexus_github_exchange_chain.py",
        "bytes": 37861,
        "sha256": "49598415210dbe65bd4cb8811ade1ef414ddfdddb5c87ac57bbb02cf24040f70",
        "source_status": "GITHUB_SOURCE_VERIFIED"
      },
      {
        "repository": "nexusomegac27/NEXUS-OMEGA-EVIDENCE",
        "commit": "120eace7fb807552148cdecd52eeb07cc4fc9c3c",
        "path": "docs/architecture/NEXUS_AGENT_COMMUNICATION_FRAMEWORK_V1_LIVING_FOUNDATION_20261031_R0.md",
        "bytes": 8469,
        "sha256": "c6c941991f870d8497427824b6b9afefe10f2ec945524be350d57810cbe438ef",
        "source_status": "GITHUB_SOURCE_VERIFIED"
      }
    ],
    "missing_source_policy": "HOLD_SCOPED_NOT_RECONSTRUCT",
    "copyright_privacy": "PUBLIC_SAFE_RESEARCH_SYNTHESIS_ONLY; RAW_OPERATOR_UPLOADED_MISTRAL_RETURN_STAYS_OUT_OF_PUBLIC_GITHUB; EXTERNAL_REPORT_OPERATOR_RELAYED_SHA256_f67e42cc9f4e08007cdf55b302d823d94dcb1d93df19f17a95bd0afeb7a68750",
    "independent_rehash_required": true
  },
  "return_contract": {
    "recipient": "NEXUS_OPERATOR_AXIOM",
    "inbox_issue_url": "https://github.com/nexusomegac27/NEXUS-OMEGA-EVIDENCE/issues/93",
    "transport_class": "OPERATOR_TO_AXIOM_BRIDGE",
    "manifest_schema": "schema/expert-hash-handshake-v1.schema.json",
    "receiver_ack": "PENDING_AXIOM_INDEPENDENT_REHASH",
    "scientific_adjudication_separate": true
  },
  "quality_gates": {
    "functionality_performance": [
      "PINNED_12_OF_12_ORIGINAL_PYTHON_DIAGNOSTIC_EXPECTED_DEFECT_REPRODUCED_NOT_SECURITY_PASS",
      "REPAIRED_ORIGINAL_PYTHON_TESTS_ACTUAL_CI_REQUIRED",
      "PUBLIC_AGENT_COMMUNICATION_V1_CLOSED_LIVING_PRESERVED"
    ],
    "robustness_stability": [
      "NO_SHA_CLAIM_PROMOTION_WITHOUT_INDEPENDENT_FETCH",
      "NO_EXTERNAL_IDENTITY_FROM_GITHUB_COMMENT_UNREGISTERED",
      "REPLAY_RECOVERY_AND_ATOMICITY_TESTS_BEFORE_CUTOVER",
      "NO_PUBLIC_WRITE_OR_OWNER_AUTHORITY_ESCALATION"
    ],
    "traceability_comprehensibility": [
      "MISTRAL_EXTERNAL_FILE_55895_SHA256_f67e42cc_INDEPENDENT_LOCAL_INTAKE",
      "MISTRAL_INTERNAL_RETURN_BODY_SELF_HASH_SCOPE_NOT_REPRODUCED",
      "GITHUB_SOURCE_ORIGINAL_BYTES_HASHES",
      "CI_RUN_41270081586_JOB_124740888286",
      "ALL_UNEXECUTED_LIVE_ENVIRONMENT_TESTS_EXPLICIT"
    ]
  }
}
