{
  "schema_version": "1.0.0",
  "object": "NEXUS_OMEGA_AXIOM_CURSOR_OPPO_NATIVE_AUTOSTOP_LOCALSEAL_FAILCLOSED_REPAIR_TASK_ANCHOR_20261101_R0",
  "norm_id": "NEXUS_OMEGA_TASK_ANCHOR_NORM_V1",
  "norm_class": "NEXUS_INTERNAL_BINDING_TECHNICAL_SPECIFICATION",
  "din_status": "DIN_SPEC_92001_1_INSPIRED_NOT_DIN_ISSUED_NOT_CERTIFIED",
  "claim_ceiling": "C1_DESCRIPTIVE_ONLY",
  "origin": {
    "operator_authority": "OPERATOR_GOVERNED_ONLY",
    "issuer_role": "AXIOM",
    "recipient_role": "CURSOR",
    "verified_github_actor": "NOT_ESTABLISHED_EXTERNAL_AGENT",
    "predecessor_object": "NEXUS_OMEGA_AXIOM_CURSOR_OPPO_UNATTENDED_NO_ADB_CAPTURE_AUTONOMY_HARD_PROOF_ORDER_20261101_R0",
    "predecessor_repository": "nexusomegac27/NEXUS-OMEGA-EVIDENCE",
    "predecessor_commit": "cb6d66800a1fbfc6579c393b4d20ee683c655714",
    "predecessor_path": "research/communication/oppo-native-app-independent-audit-20261101/AXIOM_CURSOR_OPPO_UNATTENDED_NO_ADB_CAPTURE_AUTONOMY_HARD_PROOF_ORDER_20261101_R0.md",
    "predecessor_bytes": 18871,
    "predecessor_sha256": "69656966c94dfeb59f37d0ce63076e92922009d5fbb768740a8d0194b4329e88"
  },
  "delegation": {
    "scope": "OPPO_NATIVE_SERVICE_AUTO_STOP_GZIP_LOCAL_SEAL_RECOVERY_HARD_REPAIR_AND_ZERO_OPERATOR_NO_ADB_RETEST_C1",
    "allowed_actions": [
      "READ_ONLY_CURRENT_OPPO_FOREGROUND_SERVICE_RECORDING_AND_STORAGE_CENSUS",
      "PERFORM_PROVEN_NONDESTRUCTIVE_NATIVE_STOP_FOR_SAFETY_IF_RUNNING",
      "PRESERVE_PREVIOUS_OPPO_SCIENCE_AND_LOCAL_DIRTY_WORKTREE",
      "VERIFY_NATIVE_LAUNCH_ACTIVITY_FGS_STICKY_NULL_INTENT_SOURCE",
      "PATCH_KOTLIN_NATIVE_DURABLE_RECORDING_STATE_MACHINE",
      "IMPLEMENT_MONOTONIC_DURATION_STOP_AND_ATOMIC_LOCAL_SEAL",
      "GUARD_INVALID_ACTION_AND_IDEMPOTENT_SESSION_REPLAY",
      "IMPLEMENT_SERVICE_RESTART_RECOVERY_WITHOUT_FALSE_SEAL",
      "RUN_KOTLIN_UNIT_NEGATIVE_AND_NONDESTRUCTIVE_OPPO_INSTRUMENTATION",
      "AFTER_TEST_PASS_RUN_UNATTENDED_OPPO_START_STOP_SEAL_AFTER_ADB_DISCONNECT",
      "AUTOMATED_POST_SEAL_RECONNECT_AND_PRIVATE_SOURCE_REHASH",
      "COMMIT_SOURCE_SAFE_RECEIPTS_AND_NORM_V1_ANCHOR_TO_SCOPED_GITHUB_PR"
    ],
    "prohibited_actions": [
      "RETEST_WITHOUT_PROVEN_NATIVE_STOP_AND_SEAL",
      "FORCE_STOP_OR_PM_CLEAR_APP_AS_SEAL_REPLACEMENT",
      "UNAUTHORIZED_OPPO_UNINSTALL_REINSTALL_DATA_DELETION",
      "UNAUTHORIZED_FOREGROUND_PERMISSIONS_OR_ACCESSIBILITY_BYPASS",
      "ADB_REMOTE_START_STOP_SEAL_AFTER_HOST_DISCONNECT",
      "REWRITE_OLD_FAILURE_AS_PASS_OR_13_26_SHA_MISMATCH_AS_MATCH",
      "ERASE_OR_REPLACE_PREVIOUS_IMU_SCIENCE_AND_S1_S5_DIRTY",
      "PUBLIC_GITHUB_RAW_IMU_GPS_OR_DEBUG_NETWORK_IDENTIFIERS",
      "UNREVIEWED_PRIVATE_ENDPOINT_OR_PUBLIC_WRITE_API",
      "UNVERIFIED_EXTERNAL_AGENT_ACK_OR_CUTOVER_ACTIVE",
      "PIXEL9A_DEVICE_ACTION_OR_DUAL_TWIN_SYNC",
      "R27E_VALIDATOR_WEAKEN_OR_FRAMEWORK_V1_RESET",
      "CLAIM_ABOVE_C1"
    ],
    "write_slot": "NOT_ALLOCATED",
    "runtime_authorized": false,
    "node_reset_authorized": false,
    "claim_promotion_authorized": false
  },
  "mission": {
    "question": "Repair the identified OPPO Android Foreground Service missing automatic STOP and local finalization, with durable idempotent lifecycle and crash recovery, then prove a complete unattended START/CAPTURE/STOP/SEAL session without an active host ADB connection or Operator input.",
    "deliverables": [
      "S0_OPPO_PRIOR_RECORDING_SAFE_CLOSED_OR_SCOPED_HOLD",
      "PINNED_FAILCLOSED_11569_BYTE_AX_ORDER_AND_REAL_SHA256",
      "EXACT_KOTLIN_SOURCE_AUDIT_AND_BACKUP",
      "DURABLE_ARM_RECORD_STOPPING_SEALED_WITH_RECOVERY_PENDING_STATES",
      "MONOTONIC_STOP_DEADLINE_AND_NULL_STICKY_RESTART_GUARD",
      "LOCALSEAL_REAL_GZIP_CRC_SHA256_FS_ATOMIC_MANIFEST",
      "UNKNOWN_ACTION_FAIL_CLOSED_ANDROID_NEGATIVE",
      "RACE_AND_PROCESS_DEATH_NEGATIVE_TEST_SUITE",
      "OPPO_REAL_NO_ADB_NATIVE_START_CAPTURE_STOP_AND_SEAL",
      "PRIVATE_DEVICE_HOST_RAW_BYTE_REHASH_AND_TEMPORAL_PROVENANCE",
      "NEW_PUBLIC_SAFE_GITHUB_SOURCE_HASH_MANIFEST",
      "HISTORICAL_13_26_MISMATCH_PRESERVED_AND_PIXEL_HOLD"
    ],
    "falsifiers": [
      "OPPO_APP_STILL_UNBOUNDED_RECORDING_AFTER_PRIOR_FAILED_TEST",
      "STOPPING_NOT_PERSISTED_BEFORE_SENSOR_UNREGISTER",
      "ONDESTROY_ONLY_SEAL",
      "START_STICKY_NULL_INTENT_TRIGGERS_NEW_CAPTURE",
      "HANDLER_DELAY_POSTED_BUT_NEVER_EXECUTED_ASSUMED_SUCCESS",
      "DUPLICATE_STOP_CORRUPTS_GZIP",
      "UNKNOWN_STOP_ACTION_STARTS_CAPTURE",
      "LOST_SESSION_BYTES_OR_OLD_OPPO_FILES_MODIFIED",
      "HOST_ADB_COMMAND_DURING_SENSOR_WINDOW",
      "SEAL_AFTER_HOST_RECONNECT_PASSED_AS_NATIVE",
      "PUBLIC_SENSOR_BYTES_OR_DEVICE_DEBUG_ID_EXPOSED",
      "MODEL_CLAIM_PROMOTED_ABOVE_C1"
    ],
    "acceptance_tests": [
      "CURRENT_REAL_DEVICE_SESSION_STATE_VERIFIED_BEFORE_RETEST",
      "KOTLIN_SOURCE_DIAGNOSTIC_REAL_LINES_AND_VERSION",
      "MONOTONIC_TIMER_NATIVE_AUTO_STOP_CAUSAL_EVENTS",
      "GZIP_CRC_FINISH_AND_MANIFEST_BYTES_SHA256_AFTER_FLUSH",
      "STOPPING_AND_SEALED_DURABLY_COMMITTED_IN_ORDER",
      "UNKNOWN_STOP_AND_NULL_INTENT_FAILURE_CLOSES",
      "PROCESS_KILL_RESTART_RECOVERY_NEGATIVES_REAL",
      "NO_ADB_START_CAPTURE_STOP_SEAL_ALL_WITHIN_HOST_DISCONNECTED_INTERVAL",
      "ZERO_OPERATOR_MANUAL_INPUT",
      "NEW_RAW_GITHUB_RECEIPTS_SHA256_FULL_MATCH_OR_EXPLICIT_HOLD",
      "ORIGINAL_13_OF_26_GITHUB_SOURCE_MISMATCH_UNCHANGED",
      "PIXEL9A_NOT_ADMITTED"
    ],
    "pause_conditions": [
      "CURRENT_RECORDING_CANNOT_BE_STOPPED_WITH_PROVEN_SAFE_NATIVE_PATH",
      "UNSAFE_APP_INSTALL_SIGNATURE_MIGRATION_OR_BACKUP",
      "NEW_SYSTEM_PERMISSION_USER_INTERACTION_NEEDED",
      "ANDROID_SOURCE_OR_SEALED_PRIVATE_BYTES_UNAVAILABLE",
      "ADB_AUTORECONNECT_BETWEEN_START_AND_NATIVE_LOCAL_SEAL",
      "UNREVIEWED_PRIVATE_SOURCE_PUBLICATION_RISK"
    ],
    "not_executed": [
      "ORIGINAL_CURSOR_LOCAL_RETURN_BYTES_NOT_INDEPENDENTLY_READ_BY_AXIOM",
      "OPPO_HARDWARE_DEVICE_CURRENT_STATE_NOT_INDEPENDENTLY_OBSERVED_BY_AXIOM",
      "SUCCESSFUL_NO_ADB_START_STOP_SEAL_NOT_YET_DEMONSTRATED",
      "PIXEL9A_A36A_A36B_NOT_AUTHORIZED",
      "EXTERNAL_AGENT_ACK_NOT_ESTABLISHED"
    ]
  },
  "continuity": {
    "anchor_id": "NEXUS_OMEGA_AXIOM_CURSOR_OPPO_NATIVE_AUTOSTOP_LOCALSEAL_FAILCLOSED_REPAIR_TASK_ANCHOR_20261101_R0",
    "rebind_mode": "DRIFT_RESET_ONLY",
    "node_reset_prohibited": true,
    "history_preserved": true,
    "source_bytes_preserved": true,
    "observations_preserved": true,
    "checkpoints_preserved": true,
    "runtime_state_preserved": true,
    "drift_triggers": [
      "REPEAT_TEST_WITHOUT_SAFE_NATIVE_STOP",
      "NO_ADB_FALSE_PASS_FROM_RECONNECT_SEAL",
      "BAD_STOP_ACTION_START",
      "RAW_OPPO_SENSOR_PUBLIC",
      "OPPO_PRIOR_HISTORY_LOST",
      "ORIGINAL_FAILED_RETURN_RELABELED_SUCCESS",
      "PIXEL9A_ACTION",
      "R27E_WEAKENED"
    ],
    "rebind_procedure": "RELOAD_VERIFIED_ANCHOR_APPEND_DIFFERENCE_WITNESS_NO_DELETION",
    "correction_policy": "APPEND_ONLY_SUCCESSOR"
  },
  "provenance": {
    "sources": [
      {
        "repository": "nexusomegac27/NEXUS-OMEGA-EVIDENCE",
        "commit": "e0c3b608bc524b488d4b33d6c3ff8ccaf7371816",
        "path": "research/communication/oppo-native-app-independent-audit-20261101/AXIOM_CURSOR_OPPO_NATIVE_AUTOSTOP_LOCALSEAL_FAILCLOSED_REPAIR_ORDER_20261101_R0.md",
        "bytes": 11569,
        "sha256": "795bb9f11561de3ff2ef171dc803ad50738247af0c83ccc08a8c91704effdd8b",
        "source_status": "GITHUB_SOURCE_VERIFIED"
      },
      {
        "repository": "nexusomegac27/NEXUS-OMEGA-EVIDENCE",
        "commit": "cb6d66800a1fbfc6579c393b4d20ee683c655714",
        "path": "research/communication/oppo-native-app-independent-audit-20261101/AXIOM_CURSOR_OPPO_UNATTENDED_NO_ADB_CAPTURE_AUTONOMY_HARD_PROOF_ORDER_20261101_R0.md",
        "bytes": 18871,
        "sha256": "69656966c94dfeb59f37d0ce63076e92922009d5fbb768740a8d0194b4329e88",
        "source_status": "GITHUB_SOURCE_VERIFIED"
      },
      {
        "repository": "nexusomegac27/NEXUS-OMEGA-EVIDENCE",
        "commit": "ed1f0b24edc3c67e29b7714c827d05aafda7bd83",
        "path": "research/communication/oppo-native-app-independent-audit-20261101/AXIOM_OPPO_NATIVE_APP_AND_COMMUNICATION_GATE_INDEPENDENT_ADJUDICATION_20261101_R0.md",
        "bytes": 11573,
        "sha256": "a683a231f5efb52f0fe97478850e7fc0ab33a6bbd2919a5e19d41dbe0ae9b4c2",
        "source_status": "GITHUB_SOURCE_VERIFIED"
      }
    ],
    "missing_source_policy": "HOLD_SCOPED_NOT_RECONSTRUCT",
    "copyright_privacy": "PUBLIC_SAFE_SOURCE_ONLY_RAW_IMU_PRIVATE_LOCAL; OPPO_WIFI_ADB_IP_SERIAL_MDNS_NEVER_REPUBLISHED; FAILED_LOCAL_REPORT_HASH_DECLARATIONS_NOT_REHASHED_BY_AXIOM",
    "independent_rehash_required": true
  },
  "return_contract": {
    "recipient": "NEXUS_OPERATOR_AXIOM",
    "inbox_issue_url": "https://github.com/nexusomegac27/NEXUS-OMEGA-EVIDENCE/issues/93",
    "transport_class": "OPERATOR_TO_AXIOM_BRIDGE",
    "manifest_schema": "schema/expert-hash-handshake-v1.schema.json",
    "receiver_ack": "PENDING_AXIOM_INDEPENDENT_REHASH",
    "scientific_adjudication_separate": true
  },
  "quality_gates": {
    "functionality_performance": [
      "ACTUAL_APP_OWNED_AUTOSTOP_AND_LOCALSEAL_WITHOUT_ADB",
      "ZERO_OPERATOR_INPUT_AND_DEFERRED_RECONNECT",
      "NO_FULL_NO_ADB_PASS_UNTIL_LAST_BYTE_SEAL"
    ],
    "robustness_stability": [
      "NO_CURRENT_UNBOUNDED_OPPO_RECORDING",
      "ONDESTROY_NOT_ONLY_SEAL_PATH",
      "STOPPING_PERSISTED_AND_CRASH_RECOVERY",
      "OLD_SCIENCE_AND_13_26_INTEGRITY_GAP_PRESERVED"
    ],
    "traceability_comprehensibility": [
      "GITHUB_ORDER_11569_BYTES_SHA_795bb9f1",
      "SOURCE_VERIFIED_PARENT_PR267",
      "FAILED_LOCAL_RETURN_REPORT_ONLY",
      "ANDROID_NATIVE_TEST_VS_GITHUB_SOURCE_CI_SEPARATE"
    ]
  }
}
